{
  "schema_version": "vvfp.vv3_full256_serializer_evidence.v1",
  "status": "static_serializer_reader_go_writer_rollback_stop",
  "enabled": false,
  "catalog_visible": false,
  "native_output": false,
  "runtime_go": false,
  "player_go": false,
  "publication_ready": false,
  "bindings": {
    "stock_sha256": "8BC5DB382D02BC5C21AD5F607580D60FF44A6519CC7EB133F03113BAACAE6503",
    "expanded_manifest": {"path": "data/expanded_256.json", "row_count": 1263, "rows_sha256": "04B93127BC4D5C6787AB013DE9205813D44947DBC16A370DBC234C06588AC3FB"},
    "parents": [
      {"mode": "experimental_expanded_256", "sha256": "657D321B2F1E9E6D6C223DB1FF0BBA38C2D761A97A6E7F21B98CE1826531A848", "size": 835584},
      {"mode": "experimental_expanded_256_progression", "sha256": "3A35745C00102A0964DF6E81B77707539C5BDC03501011F43FF1D2809015B211", "size": 835584}
    ]
  },
  "replacement": {
    "section": ".vv3sv",
    "section_raw": "0xCC000",
    "section_rva": "0x3B9000",
    "section_va": "0x7B9000",
    "section_sha256": "9F82D59D1436B17ACA69CD637AB40D44DF35323DA46600AAA5FD07315C249B64",
    "serializer_raw": "0xCC000",
    "serializer_sha256": "451EF9D65A9613247FAB9C8C586387F05329F9B6E6048CEE07D0B88E6BE4374E",
    "deserializer_raw": "0xCC200",
    "deserializer_sha256": "C61D124EFBDADF63D3C128E4B23BB0F80AE2D07B031A53396E4BFFF032268775",
    "failure_gate_raw": "0xCC3C0",
    "failure_gate_sha256": "A61E6CAE007E78F4A2ADC3173D3E3C7261E69DA1F9C031EAED441288C105A99B",
    "serializer_hook": {"raw": "0x27D57", "before": "E824720300", "after": "E864163900", "target": "0x7B93C0"},
    "deserializer_hook": {"raw": "0x28A4C", "before": "E80F3E0300", "after": "E8AF073900", "target": "0x7B9200"},
    "results": [
      {"mode": "experimental_expanded_256", "sha256": "585EC60285F20A55658B5CB77E8A81D5B6A632B3A399058F01EB732B4777976B", "checksum": "27F40C00"},
      {"mode": "experimental_expanded_256_progression", "sha256": "3B93CFDD98112D54F4457AA4E84838F98E577DF0AF1B9C20903E1C4CC8F276A8", "checksum": "316F0D00"}
    ]
  },
  "atomic_writer": {"status": "STOP", "hook_raw": null, "hook_before": null, "hook_after": null, "wrapper_bytes": null, "resolver_bytes": null, "final_sha256": null},
  "whole_load_rollback": {"status": "STOP", "hook_raw": null, "hook_before": null, "hook_after": null, "snapshot_bytes": null, "rollback_bytes": null, "final_sha256": null},
  "runtime_evidence": {"status": "absent", "receipts": []},
  "player_evidence": {"status": "absent", "receipts": []}
}
